[
  {
    "event_id": "zjj-cap-ticket-01",
    "event_type": "CAPACITY_REPORTED",
    "aggregate_type": "capacity_source",
    "aggregate_id": "cap-tickets-main",
    "occurred_at": "2026-10-03T12:00:00+08:00",
    "version": 1,
    "summary": "景区主门票分时可售数量上报",
    "data_sharing": {
      "visibility": "public",
      "purpose": "current_safeguard_only"
    },
    "payload": {
      "owner": "scenic_area",
      "location_id": "gate-main",
      "window": {
        "starts_at": "2026-10-03T12:00:00+08:00",
        "ends_at": "2026-10-03T12:30:00+08:00",
        "granularity_minutes": 30
      },
      "metric": {
        "code": "tickets_sellable",
        "unit": "张",
        "basis": "measured",
        "counting_rule": "当前分时剩余可售票，不含已预约未入园"
      },
      "sellable_quantity": 1200,
      "realtime_occupancy": null,
      "safety_headroom": null,
      "confidence": {
        "level": "high"
      },
      "driver_factors": {
        "large_groups": 3,
        "independent_travelers_estimate": 1400,
        "visa_policy_change": {
          "policy_id": "VISA-FREE-240H-EXT",
          "expected_delta_pct": 18,
          "effective_from": "2026-10-03T00:00:00+08:00"
        }
      },
      "collection": {
        "observed_at": "2026-10-03T12:00:00+08:00",
        "transmission": "live",
        "ingested_at": "2026-10-03T12:00:00+08:00",
        "sensor_id": "ticketing-cloud"
      }
    }
  },
  {
    "event_id": "zjj-cap-onsite-01",
    "event_type": "CAPACITY_REPORTED",
    "aggregate_type": "capacity_source",
    "aggregate_id": "cap-onsite-core",
    "occurred_at": "2026-10-03T12:00:00+08:00",
    "version": 1,
    "summary": "核心景区实时占用上报",
    "data_sharing": {
      "visibility": "partners",
      "purpose": "current_safeguard_only",
      "allowed_partners": [
        "transport",
        "community"
      ]
    },
    "payload": {
      "owner": "scenic_area",
      "location_id": "core-zone",
      "window": {
        "starts_at": "2026-10-03T12:00:00+08:00",
        "ends_at": "2026-10-03T12:15:00+08:00",
        "granularity_minutes": 15
      },
      "metric": {
        "code": "persons_on_site",
        "unit": "人",
        "basis": "measured",
        "counting_rule": "闸机计数，含免签随团旅客，不含工作人员"
      },
      "sellable_quantity": null,
      "realtime_occupancy": 6100,
      "safety_headroom": 1900,
      "confidence": {
        "level": "high"
      },
      "collection": {
        "observed_at": "2026-10-03T12:00:00+08:00",
        "transmission": "live",
        "ingested_at": "2026-10-03T12:00:00+08:00",
        "sensor_id": "gate-counters"
      }
    }
  },
  {
    "event_id": "zjj-cap-onsite-02",
    "event_type": "CAPACITY_REPORTED",
    "aggregate_type": "capacity_source",
    "aggregate_id": "cap-onsite-core",
    "occurred_at": "2026-10-03T12:30:00+08:00",
    "version": 2,
    "summary": "核心景区实时占用继续上升",
    "data_sharing": {
      "visibility": "partners",
      "purpose": "current_safeguard_only",
      "allowed_partners": [
        "transport",
        "community"
      ]
    },
    "payload": {
      "owner": "scenic_area",
      "location_id": "core-zone",
      "window": {
        "starts_at": "2026-10-03T12:15:00+08:00",
        "ends_at": "2026-10-03T12:30:00+08:00",
        "granularity_minutes": 15
      },
      "metric": {
        "code": "persons_on_site",
        "unit": "人",
        "basis": "measured"
      },
      "sellable_quantity": null,
      "realtime_occupancy": 7300,
      "safety_headroom": 700,
      "confidence": {
        "level": "high"
      },
      "collection": {
        "observed_at": "2026-10-03T12:30:00+08:00",
        "transmission": "live",
        "ingested_at": "2026-10-03T12:30:00+08:00",
        "sensor_id": "gate-counters"
      }
    }
  },
  {
    "event_id": "zjj-cap-ticket-02",
    "event_type": "CAPACITY_REPORTED",
    "aggregate_type": "capacity_source",
    "aggregate_id": "cap-tickets-main",
    "occurred_at": "2026-10-03T12:40:00+08:00",
    "version": 2,
    "summary": "售票页仍显示大量余票",
    "data_sharing": {
      "visibility": "public",
      "purpose": "current_safeguard_only"
    },
    "payload": {
      "owner": "scenic_area",
      "location_id": "gate-main",
      "window": {
        "starts_at": "2026-10-03T12:30:00+08:00",
        "ends_at": "2026-10-03T13:00:00+08:00",
        "granularity_minutes": 30
      },
      "metric": {
        "code": "tickets_sellable",
        "unit": "张",
        "basis": "measured"
      },
      "sellable_quantity": 860,
      "realtime_occupancy": null,
      "safety_headroom": null,
      "confidence": {
        "level": "high"
      },
      "collection": {
        "observed_at": "2026-10-03T12:40:00+08:00",
        "transmission": "live",
        "ingested_at": "2026-10-03T12:40:00+08:00",
        "sensor_id": "ticketing-cloud"
      }
    }
  },
  {
    "event_id": "zjj-cap-shuttle-01",
    "event_type": "CAPACITY_REPORTED",
    "aggregate_type": "capacity_source",
    "aggregate_id": "cap-shuttle-west",
    "occurred_at": "2026-10-03T12:00:00+08:00",
    "version": 1,
    "summary": "西入口接驳站占用与安全余量 12:00",
    "data_sharing": {
      "visibility": "partners",
      "purpose": "current_safeguard_only",
      "allowed_partners": [
        "scenic_area",
        "community"
      ]
    },
    "payload": {
      "owner": "transport",
      "location_id": "shuttle-west-gate",
      "window": {
        "starts_at": "2026-10-03T11:50:00+08:00",
        "ends_at": "2026-10-03T12:00:00+08:00",
        "granularity_minutes": 10
      },
      "metric": {
        "code": "queue_slots_headroom",
        "unit": "人",
        "basis": "measured",
        "counting_rule": "接驳站排队容量余量=设计容量-在队人数"
      },
      "sellable_quantity": null,
      "realtime_occupancy": 480,
      "safety_headroom": 220,
      "confidence": {
        "level": "high"
      },
      "collection": {
        "observed_at": "2026-10-03T12:00:00+08:00",
        "transmission": "live",
        "ingested_at": "2026-10-03T12:00:00+08:00",
        "sensor_id": "shuttle-cam-west"
      }
    }
  },
  {
    "event_id": "zjj-cap-shuttle-02",
    "event_type": "CAPACITY_REPORTED",
    "aggregate_type": "capacity_source",
    "aggregate_id": "cap-shuttle-west",
    "occurred_at": "2026-10-03T12:15:00+08:00",
    "version": 2,
    "summary": "西入口接驳站占用与安全余量 12:15",
    "data_sharing": {
      "visibility": "partners",
      "purpose": "current_safeguard_only",
      "allowed_partners": [
        "scenic_area",
        "community"
      ]
    },
    "payload": {
      "owner": "transport",
      "location_id": "shuttle-west-gate",
      "window": {
        "starts_at": "2026-10-03T12:05:00+08:00",
        "ends_at": "2026-10-03T12:15:00+08:00",
        "granularity_minutes": 10
      },
      "metric": {
        "code": "queue_slots_headroom",
        "unit": "人",
        "basis": "measured",
        "counting_rule": "接驳站排队容量余量=设计容量-在队人数"
      },
      "sellable_quantity": null,
      "realtime_occupancy": 580,
      "safety_headroom": 120,
      "confidence": {
        "level": "high"
      },
      "collection": {
        "observed_at": "2026-10-03T12:15:00+08:00",
        "transmission": "live",
        "ingested_at": "2026-10-03T12:15:00+08:00",
        "sensor_id": "shuttle-cam-west"
      }
    }
  },
  {
    "event_id": "zjj-cap-shuttle-03",
    "event_type": "CAPACITY_REPORTED",
    "aggregate_type": "capacity_source",
    "aggregate_id": "cap-shuttle-west",
    "occurred_at": "2026-10-03T12:30:00+08:00",
    "version": 3,
    "summary": "西入口接驳站占用与安全余量 12:30",
    "data_sharing": {
      "visibility": "partners",
      "purpose": "current_safeguard_only",
      "allowed_partners": [
        "scenic_area",
        "community"
      ]
    },
    "payload": {
      "owner": "transport",
      "location_id": "shuttle-west-gate",
      "window": {
        "starts_at": "2026-10-03T12:20:00+08:00",
        "ends_at": "2026-10-03T12:30:00+08:00",
        "granularity_minutes": 10
      },
      "metric": {
        "code": "queue_slots_headroom",
        "unit": "人",
        "basis": "measured",
        "counting_rule": "接驳站排队容量余量=设计容量-在队人数"
      },
      "sellable_quantity": null,
      "realtime_occupancy": 655,
      "safety_headroom": 45,
      "confidence": {
        "level": "high"
      },
      "collection": {
        "observed_at": "2026-10-03T12:30:00+08:00",
        "transmission": "live",
        "ingested_at": "2026-10-03T12:30:00+08:00",
        "sensor_id": "shuttle-cam-west"
      },
      "community_impact": {
        "level": "noticeable",
        "detail": "排队开始外溢至西入口社区路段"
      }
    }
  },
  {
    "event_id": "zjj-cap-shuttle-04",
    "event_type": "CAPACITY_REPORTED",
    "aggregate_type": "capacity_source",
    "aggregate_id": "cap-shuttle-west",
    "occurred_at": "2026-10-03T12:40:00+08:00",
    "version": 4,
    "summary": "西入口接驳站占用与安全余量 12:40",
    "data_sharing": {
      "visibility": "partners",
      "purpose": "current_safeguard_only",
      "allowed_partners": [
        "scenic_area",
        "community"
      ]
    },
    "payload": {
      "owner": "transport",
      "location_id": "shuttle-west-gate",
      "window": {
        "starts_at": "2026-10-03T12:30:00+08:00",
        "ends_at": "2026-10-03T12:40:00+08:00",
        "granularity_minutes": 10
      },
      "metric": {
        "code": "queue_slots_headroom",
        "unit": "人",
        "basis": "measured",
        "counting_rule": "接驳站排队容量余量=设计容量-在队人数"
      },
      "sellable_quantity": null,
      "realtime_occupancy": 708,
      "safety_headroom": -8,
      "confidence": {
        "level": "high"
      },
      "collection": {
        "observed_at": "2026-10-03T12:40:00+08:00",
        "transmission": "live",
        "ingested_at": "2026-10-03T12:40:00+08:00",
        "sensor_id": "shuttle-cam-west"
      },
      "community_impact": {
        "level": "disrupted",
        "detail": "接驳站排队外溢，影响附近居民道路出行"
      }
    }
  },
  {